{"current_extensions":{"printed_labels":[{"column":47,"row":5,"text":"D04"},{"column":58,"row":5,"text":"B03"},{"column":70,"row":12,"text":"B05"},{"column":81,"row":12,"text":"D02"},{"column":70,"row":26,"text":"B04"},{"column":81,"row":26,"text":"B02"},{"column":47,"row":33,"text":"D09"},{"column":58,"row":33,"text":"D07"},{"column":70,"row":47,"text":"B07"},{"column":81,"row":47,"text":"D06"},{"column":70,"row":61,"text":"B08"},{"column":81,"row":61,"text":"D05"},{"column":70,"row":75,"text":"D13"},{"column":81,"row":75,"text":"B09"},{"column":47,"row":82,"text":"B13"},{"column":58,"row":82,"text":"D11"},{"column":162,"row":37,"text":"B02"},{"column":162,"row":38,"text":"D11"},{"column":162,"row":39,"text":"D04"},{"column":162,"row":40,"text":"B03"},{"column":162,"row":41,"text":"B13"},{"column":162,"row":42,"text":"D13"},{"column":162,"row":43,"text":"B12"},{"column":162,"row":44,"text":"D12"},{"column":173,"row":40,"text":"B05"},{"column":173,"row":42,"text":"D02"},{"column":0,"row":5,"text":"+SDBO 32"},{"column":31,"row":5,"text":"MB709AF6"},{"column":0,"row":12,"text":"+SDBO 33"},{"column":31,"row":12,"text":"MB709AQ6"},{"column":0,"row":26,"text":"+SDBO 34"},{"column":31,"row":26,"text":"MB709AG6"},{"column":0,"row":33,"text":"+SDBO 35"},{"column":31,"row":33,"text":"MB709AR6"},{"column":0,"row":47,"text":"+SDBO 36"},{"column":31,"row":47,"text":"MB709AS6"},{"column":0,"row":61,"text":"+SDBO 37"},{"column":31,"row":61,"text":"MB709AH6"},{"column":0,"row":75,"text":"+SDBO 38"},{"column":31,"row":75,"text":"MB709AJ6"},{"column":0,"row":82,"text":"+SDBO 39"},{"column":31,"row":82,"text":"MB709AK6"},{"column":210,"row":40,"text":" "},{"column":211,"row":40,"text":"+BIT COUNT ODD BYTE 4"},{"column":242,"row":40,"text":"AN4"},{"column":205,"row":40,"text":"MB995"},{"column":235,"row":0,"text":"000  MB941"},{"column":1,"row":95,"text":"M"},{"column":243,"row":95,"text":"M"},{"column":1,"row":96,"text":"B"},{"column":243,"row":96,"text":"B"},{"column":1,"row":97,"text":"9"},{"column":243,"row":97,"text":"9"},{"column":1,"row":98,"text":"4"},{"column":243,"row":98,"text":"4"},{"column":1,"row":99,"text":"1"},{"column":243,"row":99,"text":"1"},{"column":0,"row":101,"text":"000"},{"column":242,"row":101,"text":"000"},{"column":214,"row":94,"text":"SDBO PARITY CHECK BYTE 4"},{"column":211,"row":96,"text":"DATE"},{"column":218,"row":96,"text":"08-14-69"},{"column":227,"row":96,"text":"MACH."},{"column":233,"row":96,"text":"7201-02"},{"column":211,"row":98,"text":"LOG"},{"column":223,"row":98,"text":"153B"},{"column":229,"row":98,"text":"FRAME"},{"column":239,"row":98,"text":"02"},{"column":227,"row":100,"text":"P.N."},{"column":233,"row":100,"text":"2585575"},{"column":211,"row":102,"text":"IBM CORP."},{"column":226,"row":102,"text":"SDD BLK."},{"column":239,"row":102,"text":"AT"},{"column":173,"row":93,"text":"08-08-69 713380"}],"review_status":"Native source individually read; fixed245x103 lattice and graph/glyph checks completed; owner preview review completed; independent root review pending","source":"D:\\Reference Materials\\IBM 360\\IBM_360_ALD\\MB Storage Data Bus\\MB941 SDBO PARITY CHECK BYTE 4.tif","source_reviewed":true,"text_layout":{"bindings":[{"column":235,"format":"string-right-pad","mirrors":[],"pointer":"/printed_labels/46/text","row":0,"width":10},{"column":51,"format":"string-right-pad","mirrors":[],"pointer":"/nodes/0/function","row":3,"width":1},{"column":0,"format":"string-right-pad","mirrors":[],"pointer":"/printed_labels/26/text","row":5,"width":8},{"column":31,"format":"string-right-pad","mirrors":[],"pointer":"/printed_labels/27/text","row":5,"width":8},{"column":47,"format":"string-right-pad","mirrors":["/printed_labels/0/text"],"pointer":"/nodes/0/pins/0/physical_pin","row":5,"width":3},{"column":51,"format":"string-right-pad","mirrors":[],"pointer":"/nodes/0/unit","row":5,"width":5},{"column":58,"format":"string-right-pad","mirrors":["/printed_labels/1/text"],"pointer":"/nodes/0/pins/1/physical_pin","row":5,"width":3},{"column":51,"format":"string-right-pad","mirrors":[],"pointer":"/nodes/0/printed_card_portion","row":6,"width":6},{"column":51,"format":"string-right-pad","mirrors":[],"pointer":"/nodes/0/location","row":7,"width":6},{"column":51,"format":"string-right-pad","mirrors":[],"pointer":"/nodes/0/grid","row":8,"width":2},{"column":55,"format":"string-right-pad","mirrors":[],"pointer":"/nodes/0/id","row":8,"width":2},{"column":74,"format":"string-right-pad","mirrors":[],"pointer":"/nodes/1/function","row":10,"width":1},{"column":0,"format":"string-right-pad","mirrors":[],"pointer":"/printed_labels/28/text","row":12,"width":8},{"column":31,"format":"string-right-pad","mirrors":[],"pointer":"/printed_labels/29/text","row":12,"width":8},{"column":70,"format":"string-right-pad","mirrors":["/printed_labels/2/text"],"pointer":"/nodes/1/pins/0/physical_pin","row":12,"width":3},{"column":74,"format":"string-right-pad","mirrors":[],"pointer":"/nodes/1/unit","row":12,"width":5},{"column":81,"format":"string-right-pad","mirrors":["/printed_labels/3/text"],"pointer":"/nodes/1/pins/1/physical_pin","row":12,"width":3},{"column":74,"format":"string-right-pad","mirrors":[],"pointer":"/nodes/1/printed_card_portion","row":13,"width":6},{"column":74,"format":"string-right-pad","mirrors":[],"pointer":"/nodes/1/location","row":14,"width":6},{"column":74,"format":"string-right-pad","mirrors":[],"pointer":"/nodes/1/grid","row":15,"width":2},{"column":78,"format":"string-right-pad","mirrors":[],"pointer":"/nodes/1/id","row":15,"width":2},{"column":74,"format":"string-right-pad","mirrors":[],"pointer":"/nodes/2/function","row":24,"width":1},{"column":0,"format":"string-right-pad","mirrors":[],"pointer":"/printed_labels/30/text","row":26,"width":8},{"column":31,"format":"string-right-pad","mirrors":[],"pointer":"/printed_labels/31/text","row":26,"width":8},{"column":70,"format":"string-right-pad","mirrors":["/printed_labels/4/text"],"pointer":"/nodes/2/pins/0/physical_pin","row":26,"width":3},{"column":74,"format":"string-right-pad","mirrors":[],"pointer":"/nodes/2/unit","row":26,"width":5},{"column":81,"format":"string-right-pad","mirrors":["/printed_labels/5/text"],"pointer":"/nodes/2/pins/1/physical_pin","row":26,"width":3},{"column":74,"format":"string-right-pad","mirrors":[],"pointer":"/nodes/2/printed_card_portion","row":27,"width":6},{"column":74,"format":"string-right-pad","mirrors":[],"pointer":"/nodes/2/location","row":28,"width":6},{"column":74,"format":"string-right-pad","mirrors":[],"pointer":"/nodes/2/grid","row":29,"width":2},{"column":78,"format":"string-right-pad","mirrors":[],"pointer":"/nodes/2/id","row":29,"width":2},{"column":51,"format":"string-right-pad","mirrors":[],"pointer":"/nodes/3/function","row":31,"width":1},{"column":0,"format":"string-right-pad","mirrors":[],"pointer":"/printed_labels/32/text","row":33,"width":8},{"column":31,"format":"string-right-pad","mirrors":[],"pointer":"/printed_labels/33/text","row":33,"width":8},{"column":47,"format":"string-right-pad","mirrors":["/printed_labels/6/text"],"pointer":"/nodes/3/pins/0/physical_pin","row":33,"width":3},{"column":51,"format":"string-right-pad","mirrors":[],"pointer":"/nodes/3/unit","row":33,"width":5},{"column":58,"format":"string-right-pad","mirrors":["/printed_labels/7/text"],"pointer":"/nodes/3/pins/1/physical_pin","row":33,"width":3},{"column":51,"format":"string-right-pad","mirrors":[],"pointer":"/nodes/3/printed_card_portion","row":34,"width":6},{"column":51,"format":"string-right-pad","mirrors":[],"pointer":"/nodes/3/location","row":35,"width":6},{"column":51,"format":"string-right-pad","mirrors":[],"pointer":"/nodes/3/grid","row":36,"width":2},{"column":55,"format":"string-right-pad","mirrors":[],"pointer":"/nodes/3/id","row":36,"width":2},{"column":162,"format":"string-right-pad","mirrors":[],"pointer":"/printed_labels/16/text","row":37,"width":3},{"column":162,"format":"string-right-pad","mirrors":[],"pointer":"/printed_labels/17/text","row":38,"width":3},{"column":162,"format":"string-right-pad","mirrors":[],"pointer":"/printed_labels/18/text","row":39,"width":3},{"column":162,"format":"string-right-pad","mirrors":[],"pointer":"/printed_labels/19/text","row":40,"width":3},{"column":173,"format":"string-right-pad","mirrors":[],"pointer":"/printed_labels/24/text","row":40,"width":3},{"column":205,"format":"string-right-pad","mirrors":[],"pointer":"/printed_labels/45/text","row":40,"width":5},{"column":210,"format":"string-right-pad","mirrors":[],"pointer":"/printed_labels/42/text","row":40,"width":1},{"column":211,"format":"string-right-pad","mirrors":[],"pointer":"/printed_labels/43/text","row":40,"width":21},{"column":242,"format":"string-right-pad","mirrors":[],"pointer":"/printed_labels/44/text","row":40,"width":3},{"column":162,"format":"string-right-pad","mirrors":[],"pointer":"/printed_labels/20/text","row":41,"width":3},{"column":162,"format":"string-right-pad","mirrors":[],"pointer":"/printed_labels/21/text","row":42,"width":3},{"column":173,"format":"string-right-pad","mirrors":[],"pointer":"/printed_labels/25/text","row":42,"width":3},{"column":162,"format":"string-right-pad","mirrors":[],"pointer":"/printed_labels/22/text","row":43,"width":3},{"column":162,"format":"string-right-pad","mirrors":[],"pointer":"/printed_labels/23/text","row":44,"width":3},{"column":74,"format":"string-right-pad","mirrors":[],"pointer":"/nodes/4/function","row":45,"width":1},{"column":0,"format":"string-right-pad","mirrors":[],"pointer":"/printed_labels/34/text","row":47,"width":8},{"column":31,"format":"string-right-pad","mirrors":[],"pointer":"/printed_labels/35/text","row":47,"width":8},{"column":70,"format":"string-right-pad","mirrors":["/printed_labels/8/text"],"pointer":"/nodes/4/pins/0/physical_pin","row":47,"width":3},{"column":74,"format":"string-right-pad","mirrors":[],"pointer":"/nodes/4/unit","row":47,"width":5},{"column":81,"format":"string-right-pad","mirrors":["/printed_labels/9/text"],"pointer":"/nodes